results/development_metrics.csv

,Moving Average Strategy,Buy and Hold
Cumulative Return,0.2755192051352642,1.0623360645232913
Annualised Return,0.06624968741656545,0.21022082359106808
Annualised Volatility,0.18046454594785433,0.2614093578100082
Sharpe Ratio (rf=0),0.4454850986448187,0.8605084539863311
Maximum Drawdown,-0.2980015329806568,-0.30912808992698537

README.md

Metric	Strategy	Buy and hold
Cumulative return	27.6%	106.2%
Annualised return	6.6%	21.0%
Annualised volatility	18.0%	26.1%
Sharpe ratio	0.445	0.861
Maximum drawdown	-29.8%	-30.9%